section,row_name,field,value,source_url,notes
file-backed,CLAUDE.md,created,2024-10 (first appeared in Claude Code public release; Claude Code beta May 2024; GA Oct 2024),https://support.claude.com/en/articles/12138966-release-notes,Claude Code beta launched May 2024; CLAUDE.md pattern emerged with it
file-backed,CLAUDE.md,mindshare,no data — searched not found; not indexed as a standalone product,https://docs.claude.com/en/docs/claude-code/memory,File pattern — no GitHub repo or npm package to track
file-backed,Cursor Rules,created,2023-03 (Cursor launched March 2023; .cursorrules file supported from initial release),https://word-spinner.com/blog/when-did-cursor-ai-come-out/,".cursorrules introduced at Cursor's March 2023 launch; multi-file .cursor/rules/ added 2024"
file-backed,Cursor Rules,mindshare,no data — searched not found; Cursor IDE has ~35M+ developers but .cursorrules file itself has no standalone tracker,https://docs.cursor.com/context/rules,Anysphere raised $900M at $9B valuation (2025)
file-backed,Windsurf Rules & Memories,created,2024-11 (Windsurf Editor launched November 2024; Cascade Memories feature included at launch),https://windsurf.com/changelog,Codeium rebranded to Windsurf in April 2025
file-backed,Windsurf Rules & Memories,mindshare,no data — searched not found,https://docs.windsurf.com/windsurf/cascade/memories,Codeium/Windsurf has ~800k users as of 2024
file-backed,AGENTS.md,created,2025-05 (introduced with OpenAI Codex CLI research preview May 16 2025; donated to Linux Foundation AAIF Dec 2025),https://openai.com/index/introducing-codex/,Codex CLI research preview shipped May 16 2025 with AGENTS.md support
file-backed,AGENTS.md,mindshare,no data — searched not found; 20000+ repos claim is self-reported,https://agents.md/,"No independent tracker; 20k repos cited by agents.md site, unverified"
file-backed,GitHub Copilot custom instructions,created,2024 (repository custom instructions GA in 2024; path-scoped .instructions.md added July 2025),https://docs.github.com/copilot/customizing-copilot/adding-custom-instructions-for-github-copilot,Feature became fully practical in 2024; no exact month found
file-backed,GitHub Copilot custom instructions,pricing,not applicable — file pattern included in GitHub Copilot subscription ($10/mo individual; $19/mo business; $39/mo enterprise),https://github.com/features/copilot,Instructions file itself is free feature of Copilot subscription
file-backed,GitHub Copilot custom instructions,deployment,not applicable — GitHub-hosted; no separate deployment,https://docs.github.com/copilot/customizing-copilot/adding-custom-instructions-for-github-copilot,Built into GitHub Copilot SaaS
file-backed,GitHub Copilot custom instructions,mindshare,no data — searched not found; GitHub Copilot has 1.8M+ paid users but custom instructions feature share not tracked,https://docs.github.com/copilot/customizing-copilot/adding-custom-instructions-for-github-copilot,No specific mindshare signal for this sub-feature
file-backed,Aider CONVENTIONS.md,created,2023-06 (Aider launched June 2023 by Paul Gauthier; CONVENTIONS.md pattern included from early versions),https://aider.chat/docs/usage/conventions.html,Aider first committed June 2023; conventions file is a core pattern
file-backed,Aider CONVENTIONS.md,mindshare,44.4k GitHub stars (aider.chat/aider repo); +1.7k/mo growth; 2nd most-starred terminal coding agent,https://github.com/Aider-AI/aider,Strong mindshare among terminal-based coding workflows
file-backed,Cline .clinerules,created,2024-07 (Cline launched as Claude Dev July 2024; rebranded Cline Oct 2024; .clinerules added post-launch),https://marketplace.visualstudio.com/items?itemName=saoudrizwan.claude-dev,"Claude Dev launched July 2024; .clinerules feature added in subsequent months, ~late 2024"
file-backed,Cline Memory Bank,created,2024-11 (community pattern formalized after Cline's October 2024 rebrand; adopted ~Nov-Dec 2024),https://docs.cline.bot/features/memory-bank,Community convention emerging alongside .clinerules development
file-backed,Cline Memory Bank,mindshare,no data — searched not found; Cline has 1.8M VS Code installs but Memory Bank sub-feature not separately tracked,https://docs.cline.bot/features/memory-bank,1.8M installs for Cline overall (TechCrunch)
file-backed,Roo Code .roorules,created,2024-12 (Roo Code forked from Cline in late 2024; .roorules added as distinct pattern post-fork),https://marketplace.visualstudio.com/items?itemName=RooVeterinaryInc.roo-cline,Roo Code emerged late 2024 as Cline fork; note: Roo Code shutting down May 15 2026
file-backed,Roo Code .roorules,mindshare,no data — searched not found; note Roo Code is shutting down May 15 2026 and pivoting to Roomote cloud agent,https://www.roocode.com/,Roo Code announced shutdown of VS Code extension May 2026
file-backed,Continue.dev .continue/rules,created,2023-07 (Continue.dev YC S23 launched July 2023; rules feature added in later iterations),https://news.ycombinator.com/item?id=43494427,Continue launched July 2023 (HN Launch post); .continue/rules pattern added in 2024
file-backed,Continue.dev .continue/rules,mindshare,no data — searched not found,https://docs.continue.dev/customize/deep-dives/rules,Continue.dev: open-source; ~8k GitHub stars as of 2025
file-backed,Zed .rules,created,2024-08 (Zed AI launched August 22 2024 with Anthropic collaboration; .rules pattern came with or shortly after),https://zed.dev/blog/zed-ai,"Zed AI (and .rules) launched Aug 2024; Zed v1.0 released April 30 2026"
file-backed,Zed .rules,mindshare,no data — searched not found; Zed is a Rust-built editor with growing but niche user base,https://zed.dev/,Founded Nathan Sobo & Antonio Scandurra; a16z-backed; smaller install base than Cursor/VSCode
file-backed,Replit replit.md,created,2024-09 (Replit Agent launched September 2024; replit.md memory file part of Agent feature),https://blog.replit.com/agent-v2,Replit Agent launched Sep 2024 after ~15 months dev; replit.md part of Agent context
file-backed,Replit replit.md,mindshare,no data — searched not found; Replit overall has 30M+ users but replit.md sub-feature not tracked,https://replit.com/products/agent,Replit platform: Coinbase/Zillow/Mercedes-Benz among customers
file-backed,Sourcegraph Cody — cody.json,created,2023-09 (Cody custom commands experimental in VS Code v0.10 Sep 3 2023; GA Dec 2023),https://sourcegraph.com/blog/cody-vscode-0-10-release,Cody v0.10 shipped Sep 3 2023 with custom commands; GA Dec 2023
file-backed,Sourcegraph Cody — cody.json,mindshare,no data — searched not found,https://docs.sourcegraph.com/cody/custom-commands,Sourcegraph is a16z-backed enterprise code search company
claude-code-mechanisms,Claude Code auto-memory,created,2025-03 (Claude Code v1.0 launched Feb/Mar 2025; auto-memory feature in subsequent releases; v2.1.59+ required),https://docs.claude.com/en/docs/claude-code/memory,Auto-memory requires Claude Code v2.1.59+; exact launch date of feature not published
claude-code-mechanisms,Claude Code auto-memory,mindshare,no data — searched not found; Claude Code is Anthropic-owned so no GitHub stars; widely discussed in developer community,https://docs.claude.com/en/docs/claude-code/memory,No independent metric; Anthropic does not publish Claude Code install numbers
claude-code-mechanisms,Superpowers episodic-memory plugin,mindshare,372 GitHub stars; niche community signal,https://github.com/obra/episodic-memory,Small but notable for Claude Code plugin ecosystem
claude-code-mechanisms,Superpowers episodic-memory plugin,pricing,free / open source (MIT); no paid tier,https://github.com/obra/episodic-memory,OSS plugin; no monetization
claude-code-mechanisms,Superpowers episodic-memory plugin,deployment,local — runs as Claude Code plugin via superpowers marketplace; no cloud component,https://github.com/obra/episodic-memory,SQLite per-project; all local
claude-code-mechanisms,claude-mem,mindshare,72.7k GitHub stars (+9.1k/mo); highest-starred Claude Code memory plugin,https://github.com/thedotmack/claude-mem,Top-of-ecosystem by GitHub signal
claude-code-mechanisms,claude-mem,pricing,free / open source (AGPL-3.0); no paid tier,https://github.com/thedotmack/claude-mem,OSS plugin; no monetization
claude-code-mechanisms,claude-mem,deployment,local — SQLite + FTS5 per project; optional Chroma vector; no cloud,https://github.com/thedotmack/claude-mem,All data stays on machine
claude-code-mechanisms,Mem0 MCP (official),mindshare,650 GitHub stars (mem0-mcp repo); mem0 main repo 21.8k stars,https://github.com/mem0ai/mem0-mcp,MCP wrapper around Mem0 cloud API
claude-code-mechanisms,Mem0 MCP (official),pricing,free tier (Hobby: 10K memories 1K retrieval/mo); Starter $19/mo; Pro $249/mo (graph memory included); Enterprise custom,https://mem0.ai/pricing,Graph memory requires Pro ($249/mo); confirmed May 2026
claude-code-mechanisms,Mem0 MCP (official),deployment,cloud API (managed by Mem0); MCP local install pointing to Mem0 cloud,https://docs.mem0.ai/platform/mem0-mcp,Cloud-only memory; MCP is local wrapper
claude-code-mechanisms,Graphiti MCP Server (Zep),mindshare,25.7k GitHub stars (graphiti repo); strong adoption signal,https://github.com/getzep/graphiti,Graphiti OSS with managed Zep cloud option
claude-code-mechanisms,Graphiti MCP Server (Zep),pricing,free tier: 2500 messages/mo + 2.5MB graph data; paid: $1.25/1000 messages + $2.50/MB extra; Enterprise custom,https://www.getzep.com/pricing/,Confirmed May 2026 from Zep pricing page
claude-code-mechanisms,Graphiti MCP Server (Zep),deployment,cloud (Zep managed) or self-hosted via Graphiti OSS + Neo4j/local graph DB,https://www.getzep.com/pricing/,Enterprise: BYOK BYOM BYOC VPC isolation
claude-code-mechanisms,mcp-memory-service (doobidoo),mindshare,1.8k GitHub stars; niche developer tooling,https://github.com/doobidoo/mcp-memory-service,No commercial presence
claude-code-mechanisms,mcp-memory-service (doobidoo),pricing,free / open source (Apache-2.0); no paid tier,https://github.com/doobidoo/mcp-memory-service,OSS; no monetization
claude-code-mechanisms,mcp-memory-service (doobidoo),deployment,local — SQLite-Vec default; Cloudflare hybrid for production; no managed cloud,https://github.com/doobidoo/mcp-memory-service,Author-maintained OSS
claude-code-mechanisms,OpenMemory MCP,created,2025-03 (Mem0 launched OpenMemory in early 2025; Docker Compose self-host),https://mem0.ai/openmemory,Mem0 launched OpenMemory as local-first self-hosted variant 2025
claude-code-mechanisms,OpenMemory MCP,mindshare,no data — searched not found; part of Mem0 ecosystem which has 21.8k stars overall,https://mem0.ai/openmemory,No separate GitHub repo with independent stars
claude-code-mechanisms,Cognee MCP,mindshare,17.1k GitHub stars (cognee repo); strong signal for OSS KG memory,https://github.com/topoteretes/cognee,One of top-starred KG memory projects
claude-code-mechanisms,Cognee MCP,pricing,free / open source (Apache-2.0) for self-hosted; cloud tier pricing not published,https://github.com/topoteretes/cognee,Cloud tier exists; no public pricing found
claude-code-mechanisms,Cognee MCP,deployment,self-hosted (local vector + graph DB); cloud option exists (topoteretes managed),https://github.com/topoteretes/cognee,EU startup; GDPR-oriented deployment options
claude-code-mechanisms,Hindsight MCP,created,2025-04 (Hindsight by Vectorize; Claude Code hooks referenced in late 2025),https://hindsight.vectorize.io/developer/mcp-server,Vectorize founded ~2024; Hindsight MCP launched mid-2025
claude-code-mechanisms,Hindsight MCP,mindshare,no data — searched not found; newer product with limited public signal,https://hindsight.vectorize.io/developer/mcp-server,True Ventures backed; limited public metrics
claude-code-mechanisms,Memobase MCP,mindshare,2.7k GitHub stars (memobase repo); niche adoption,https://github.com/memodb-io/memobase,No commercial presence
claude-code-mechanisms,Memobase MCP,pricing,free / open source (Apache-2.0); no published cloud pricing,https://github.com/memodb-io/memobase,FastAPI server; self-hosted
claude-code-mechanisms,Memobase MCP,deployment,self-hosted — Postgres + Redis; Docker Compose; no managed cloud offering confirmed,https://github.com/memodb-io/memobase,Open-source; no cloud SaaS
claude-code-mechanisms,claude-supermemory,mindshare,2.6k GitHub stars; small but growing Claude Code ecosystem signal,https://github.com/supermemoryai/claude-supermemory,Requires Supermemory Pro subscription
claude-code-mechanisms,claude-supermemory,pricing,requires Supermemory Pro (pricing not publicly listed; contact sales),https://github.com/supermemoryai/claude-supermemory,Plugin is free but requires paid Supermemory backend
claude-code-mechanisms,claude-supermemory,deployment,cloud — Supermemory managed API; no self-host option,https://github.com/supermemoryai/claude-supermemory,Cloud-only memory backend
claude-code-mechanisms,mcp-memory (Puliczek),mindshare,142 GitHub stars; below detection threshold,https://github.com/Puliczek/mcp-memory,Very small community
claude-code-mechanisms,mcp-memory (Puliczek),pricing,free — Cloudflare free tier: 1k memories / ~28k queries per month; no paid tier,https://github.com/Puliczek/mcp-memory,Runs on Cloudflare Workers free tier
claude-code-mechanisms,mcp-memory (Puliczek),deployment,serverless — Cloudflare Workers + Vectorize + D1; one-click Cloudflare deploy,https://github.com/Puliczek/mcp-memory,Zero separate server required
claude-code-mechanisms,local-memory-mcp,mindshare,5 GitHub stars; very early / below threshold,https://github.com/studiomeyer-io/local-memory-mcp,Brand-new project (April 2026)
claude-code-mechanisms,local-memory-mcp,pricing,free / open source (MIT); no paid tier,https://github.com/studiomeyer-io/local-memory-mcp,Zero config; npx install; no cloud
claude-code-mechanisms,local-memory-mcp,deployment,local — SQLite + FTS5; zero cloud dependency; no API keys required,https://github.com/studiomeyer-io/local-memory-mcp,Fully local-only
benchmarks,ImplicitMemBench,citations,0 (too recent — April 2026 preprint; not yet indexed on Semantic Scholar),https://arxiv.org/abs/2604.08064,April 2026 preprint; no citation count yet
benchmarks,ImplicitMemBench,founders,University of Hong Kong (Chonghan Qin Xiachong Feng Lingpeng Kong) + Harbin Institute of Technology (Weitao Ma Xiaocheng Feng),https://arxiv.org/abs/2604.08064,Confirmed from arxiv abstract page
benchmarks,ImplicitMemBench,mindshare,no data — searched not found; brand-new preprint April 2026,https://arxiv.org/abs/2604.08064,No GitHub repo; no independent adoption signal
benchmarks,MemEvoBench,citations,0 (too recent — April 17 2026 preprint; not yet indexed on Semantic Scholar),https://arxiv.org/abs/2604.15774,April 2026 preprint
benchmarks,MemEvoBench,founders,Weiwei Xie Shaoxiong Guo Fan Zhang Tian Xia Xue Yang Lizhuang Ma Junchi Yan Qibing Ren — affiliations not confirmed in abstract; likely Shanghai Jiao Tong University based on author names,https://arxiv.org/abs/2604.15774,Affiliations not confirmed from search; SJTU likely based on Junchi Yan affiliation
benchmarks,MemEvoBench,mindshare,no data — searched not found; brand-new preprint April 2026,https://arxiv.org/abs/2604.15774,No GitHub repo found
benchmarks,ICLR 2026 MemAgents Workshop,created,2026-04-27 (workshop held April 27 2026 at ICLR 2026 in Rio de Janeiro),https://sites.google.com/view/memagent-iclr26/,Workshop date confirmed from ICLR virtual schedule
benchmarks,ICLR 2026 MemAgents Workshop,mindshare,no data — searched not found; workshop proceedings not yet indexed,https://sites.google.com/view/memagent-iclr26/,Too recent for independent mindshare signal
benchmarks,LongMemEval,modalities,text (synthetic multi-session chat histories),https://arxiv.org/abs/2410.10813,Confirmed from paper abstract
benchmarks,LongMemEval,mindshare,240 citations (Semantic Scholar); most-cited dedicated agent-memory benchmark in 2025; commercial vendors (Mem0 Zep Letta) all report against it,https://www.semanticscholar.org/paper/fd48dc6b433cfcd220b6e769c6179d8ef6fcf862,Primary benchmark signal for this section
benchmarks,LongMemEval,pricing,not applicable — open benchmark; free to use,https://github.com/xiaowu0162/LongMemEval,MIT licensed; hosted on GitHub + HuggingFace
benchmarks,LongMemEval,deployment,not applicable — evaluation harness; run locally against model API,https://github.com/xiaowu0162/LongMemEval,Python scripts; no deployment needed
benchmarks,LongMemEval,tax-conflict,not applicable (evaluation benchmark),https://arxiv.org/abs/2410.10813,Read-only eval set
benchmarks,LoCoMo,modalities,text + multimodal dialogue (includes image-grounded turns),https://arxiv.org/abs/2402.17753,Confirmed from paper — tests multimodal dialogue memory
benchmarks,LoCoMo,mindshare,395 citations (Semantic Scholar); heavily used as industry benchmark by Mem0 Zep Letta ByteRover etc,https://www.semanticscholar.org/paper/0bf3a1867f7245b8a702093901c66b08b518eafc,2nd most cited memory benchmark after LongMemEval
benchmarks,LoCoMo,pricing,not applicable — open benchmark; free to use,https://snap-research.github.io/locomo/,Apache-2.0 licensed
benchmarks,LoCoMo,deployment,not applicable — evaluation harness; run locally,https://github.com/snap-research/locomo,Python + Jupyter notebooks
benchmarks,LoCoMo,tax-conflict,not applicable (evaluation benchmark),https://arxiv.org/abs/2402.17753,Read-only eval set
benchmarks,BABILong,modalities,text (bAbI synthetic reasoning tasks interleaved with PG-19 book passages),https://arxiv.org/abs/2406.10149,Confirmed from paper
benchmarks,BABILong,mindshare,196 citations (Semantic Scholar); standard long-context reasoning eval especially for recurrence models,https://www.semanticscholar.org/paper/b47507f12a8b7d26f78a484e32a08d61d3f87358,NeurIPS 2024 Datasets & Benchmarks
benchmarks,BABILong,pricing,not applicable — open benchmark; free to use,https://github.com/booydar/babilong,Apache-2.0 licensed
benchmarks,BABILong,deployment,not applicable — run locally,https://github.com/booydar/babilong,Python; also on HuggingFace datasets
benchmarks,BABILong,tax-conflict,not applicable (evaluation benchmark),https://arxiv.org/abs/2406.10149,Read-only eval set
benchmarks,RULER,modalities,text (configurable synthetic tasks),https://arxiv.org/abs/2404.06654,Confirmed from paper
benchmarks,RULER,mindshare,820 citations (Semantic Scholar); heavily used in long-context LLM release evaluations by NVIDIA and others,https://www.semanticscholar.org/paper/ac5824e9ff924a937d9eef379d0b581de2417678,COLM 2024; one of most-cited long-context benchmarks
benchmarks,RULER,pricing,not applicable — open benchmark; free to use,https://github.com/NVIDIA/RULER,Apache-2.0 licensed
benchmarks,RULER,deployment,not applicable — run locally,https://github.com/NVIDIA/RULER,Python; requires model API access
benchmarks,RULER,tax-conflict,not applicable (evaluation benchmark),https://arxiv.org/abs/2404.06654,Read-only eval set
benchmarks,HELMET,modalities,text (7 categories: RAG summarisation re-ranking classification many-shot ICL long-doc QA),https://arxiv.org/abs/2410.02694,Confirmed from paper
benchmarks,HELMET,mindshare,96 citations (Semantic Scholar); Hugging Face endorsed; Princeton NLP pedigree,https://www.semanticscholar.org/paper/4a2c19f0cfc48f166a8fd34cb8fb2bcfcb275569,ICLR 2025
benchmarks,HELMET,pricing,not applicable — open benchmark; free to use,https://github.com/princeton-nlp/HELMET,MIT licensed
benchmarks,HELMET,deployment,not applicable — run locally,https://github.com/princeton-nlp/HELMET,Python
benchmarks,HELMET,tax-conflict,not applicable (evaluation benchmark),https://arxiv.org/abs/2410.02694,Read-only eval set
benchmarks,InfiniteBench (∞Bench),modalities,text (English + Chinese: novels code math summarisation retrieval),https://arxiv.org/abs/2402.13718,Confirmed from paper
benchmarks,InfiniteBench (∞Bench),mindshare,330 citations (Semantic Scholar); adopted as 100K+ capability reference in LLM releases,https://www.semanticscholar.org/paper/f05e84702562cb693dd68d3d1c88072519a7bd71,ACL 2024
benchmarks,InfiniteBench (∞Bench),pricing,not applicable — open benchmark; free to use,https://github.com/OpenBMB/InfiniteBench,MIT licensed
benchmarks,InfiniteBench (∞Bench),deployment,not applicable — run locally,https://github.com/OpenBMB/InfiniteBench,Python; HuggingFace datasets
benchmarks,InfiniteBench (∞Bench),tax-conflict,not applicable (evaluation benchmark),https://arxiv.org/abs/2402.13718,Read-only eval set
benchmarks,LongBench,modalities,text (bilingual: English + Chinese; 21 datasets),https://arxiv.org/abs/2308.14508,Confirmed from paper
benchmarks,LongBench,mindshare,1200 citations (Semantic Scholar); one of most-cited long-context benchmarks; standard in Chinese NLP,https://www.semanticscholar.org/paper/b31a5884a8ebe96b6300839b28608b97f8f8ef76,ACL 2024; LongBench v2 at ACL 2025
benchmarks,LongBench,pricing,not applicable — open benchmark; free to use,https://github.com/THUDM/LongBench,MIT licensed
benchmarks,LongBench,deployment,not applicable — run locally,https://github.com/THUDM/LongBench,Python; HuggingFace
benchmarks,LongBench,tax-conflict,not applicable (evaluation benchmark),https://arxiv.org/abs/2308.14508,Read-only eval set
benchmarks,MemBench,modalities,text (agent memory mechanisms across 7 evaluated systems),https://arxiv.org/abs/2506.21605,Confirmed from paper
benchmarks,MemoryAgentBench,modalities,text (multi-turn dialogue fed as incremental chunks),https://arxiv.org/abs/2507.05257,Confirmed from paper
benchmarks,MemoryAgentBench,pricing,not applicable — open benchmark; free to use (unlicensed GitHub),https://github.com/HUST-AI-HYZ/MemoryAgentBench,ICLR 2026 accepted paper
benchmarks,MemoryAgentBench,deployment,not applicable — run locally,https://github.com/HUST-AI-HYZ/MemoryAgentBench,Python
benchmarks,MemoryAgentBench,tax-conflict,not applicable (evaluation benchmark),https://arxiv.org/abs/2507.05257,Read-only eval set
benchmarks,MemoryArena,modalities,text (multi-session agent task loops),https://arxiv.org/abs/2602.16313,Confirmed from paper
benchmarks,MemoryBench (Tsinghua THUIR),modalities,text (declarative + procedural memory tasks; Chinese-leaning),https://arxiv.org/abs/2510.17281,Confirmed from paper
benchmarks,NIAH (Needle in a Haystack),mindshare,no academic citations (informal GitHub project); de-facto first-pass filter for all frontier LLM releases; universally referenced,https://github.com/gkamradt/LLMTest_NeedleInAHaystack,Standard in every LLM release evaluation 2023-present
benchmarks,NIAH (Needle in a Haystack),pricing,not applicable — open source; free to use,https://github.com/gkamradt/LLMTest_NeedleInAHaystack,MIT licensed
benchmarks,NIAH (Needle in a Haystack),deployment,not applicable — run locally,https://github.com/gkamradt/LLMTest_NeedleInAHaystack,Jupyter notebook; Python
observability,Zep / Graphiti,citations,not applicable — commercial product with a paper (arxiv 2501.13956 has ~50 cites),https://www.semanticscholar.org/,Graphiti paper exists but Zep-as-observability is a product not a paper
observability,Zep / Graphiti,funding,$500K pre-seed (YC W24 March 2024); $3M seed (2024); total ~$3.5M raised,https://www.crunchbase.com/organization/zep-ai,YC W24 + undisclosed angels
observability,Zep / Graphiti,customers,no data — searched not found; Zep reports $1M ARR in 2024 with 5-person team,https://getlatka.com/companies/getzep.com,No named enterprise customer list found
observability,Zep / Graphiti,pricing,free tier: 2500 messages/mo + 2.5MB graph data; paid: $1.25/1000 messages + $2.50/MB extra; Enterprise custom with HIPAA BAA,https://www.getzep.com/pricing/,Confirmed May 2026
observability,Zep / Graphiti,deployment,cloud (Zep managed) or self-hosted (Graphiti OSS + Neo4j); Enterprise: BYOK BYOM BYOC VPC,https://www.getzep.com/pricing/,Multiple deployment options
observability,Zep / Graphiti,hq,San Francisco CA (YC W24 company),https://www.ycombinator.com/companies/zep-ai,YC W24 batch
observability,Zep / Graphiti,repro,not applicable — commercial product (Graphiti paper has partial reproducibility),https://github.com/getzep/graphiti,Graphiti is OSS; Zep cloud is managed
observability,Zep / Graphiti,code-release,Graphiti is Apache-2.0 OSS (github.com/getzep/graphiti); Zep cloud is closed,https://github.com/getzep/graphiti,Code for the memory graph layer is public
observability,Galileo (galileo.ai),created,2021 (founded 2021 by Atindriyo Sanyal Vikram Chatterji Yash Sheth; seed May 2022),https://www.prnewswire.com/news-releases/galileo-raises-45m-series-b-funding-to-bring-evaluation-intelligence-to-generative-ai-teams-everywhere-302276383.html,Founded 2021; first product round seed May 2022
observability,Galileo (galileo.ai),modalities,text (LLM trace + agent step monitoring),https://galileo.ai/,Confirmed from Galileo docs
observability,Galileo (galileo.ai),funding,$68M total ($10M seed + $13M Series A + $45M Series B Oct 2024); Scale Venture Partners + Premji Invest led Series B,https://www.prnewswire.com/news-releases/galileo-raises-45m-series-b-funding-to-bring-evaluation-intelligence-to-generative-ai-teams-everywhere-302276383.html,834% revenue growth since start of 2024
observability,Galileo (galileo.ai),customers,no data — searched not found; 834% revenue growth signal indicates meaningful enterprise adoption but no named customers found,https://galileo.ai/,Enterprise GenAI observability users
observability,Galileo (galileo.ai),pricing,free: 5K traces/mo; Pro: $100+/mo (50K traces); Enterprise: custom (VPC on-prem); runtime guardrails on Enterprise only,https://galileo.ai/pricing,Confirmed from pricing page
observability,Galileo (galileo.ai),compliance,SOC 2 Type II (enterprise); no public HIPAA statement found,https://galileo.ai/,SOC 2 enterprise tier
