paper,subgroup,citations_count,citations_source_url,repro_status,repro_source_url,code_release,code_url,founders_lab,founders_pedigree,modalities,volume_claim,conflict_resolution,mindshare_notes
HAMI,RL-augmented,no data — searched S2 no count found,https://www.nature.com/articles/s41598-025-10586-x,Too recent,https://www.nature.com/articles/s41598-025-10586-x,Paper only,no data,"Hamed Poursiami, Ayana Moshruba, Keiland W Cooper, Derek Gobin, Md Abdullah-Al Kaiser, Ankur Singh, Rouhan Noor, Babak Shahbaba, Akhilesh Jaiswal, Norbert J Fortin, Maryam Parsa; George Mason University + UC Irvine","Nature Scientific Reports 2025; George Mason University (Dept ECE, Maryam Parsa — corresponding) + UC Irvine (Center for Neurobiology of Learning and Memory)",text,no scale claim — research (Nature Scientific Reports 2025),LLM-arbitrate (hierarchical refinement),below detection threshold
LLM-ACTR / Cognitive LLMs,Cognitive-architecture-inspired,8 cites (4/yr),https://www.semanticscholar.org/paper/8544b2ff4635141062cc62333d83019c91b40979,No reproductions found,https://arxiv.org/abs/2408.09176,Paper only,no public code,"Siyu Wu, Alessandro Oltramari, Jonathan Francis, C. Lee Giles, Frank E. Ritter; Pennsylvania State University + Carnegie Mellon University","arxiv 2408.09176; PSU (Siyu Wu, C. Lee Giles) + CMU (Jonathan Francis); journal version SAGE AI 2025",text,no scale claim — research,not applicable (ACT-R buffers injected; no external write),below detection threshold
Human-Like Remembering and Forgetting,Cognitive-architecture-inspired,no data — searched S2 no count found,https://dl.acm.org/doi/10.1145/3765766.3765803,Too recent,https://dl.acm.org/doi/10.1145/3765766.3765803,Paper only,no data,"Yudai Honda, Yuki Fujita, Keiichi Zempo, Shogo Fukushima; Kyushu University + University of Tsukuba","ACM HAI 2025; Kyushu University (Yudai Honda, Shogo Fukushima — Faculty of Information Science and EE) + University of Tsukuba (Keiichi Zempo)",text,no scale claim — research (ACM HAI 2025),LLM-arbitrate (ACT-R base-level activation scoring),below detection threshold
AriGraph,Cognitive-architecture-inspired,63 cites (31/yr),https://www.semanticscholar.org/paper/e2687f80077e8466918e4aeb2ea52e591bfe7e81,No reproductions found,https://arxiv.org/abs/2407.04363,Code public + weights closed,https://github.com/AIRI-Institute/AriGraph,"Petr Anokhin, Nikita Semenov, Artyom Sorokin, Dmitry Evseev, Mikhail Burtsev, Evgeny Burnaev; AIRI Institute (AI Research Institute, Moscow)","IJCAI 2025; AIRI Institute Moscow (github.com/AIRI-Institute); arxiv 2407.04363",text,no scale claim — research,LLM-arbitrate (dual-layer KG),below detection threshold
Dual-Process Agent (DPA),Cognitive-architecture-inspired,no data — searched S2 (published Mar 2026),https://www.mdpi.com/2079-9292/15/6/1232,Too recent,https://www.mdpi.com/2079-9292/15/6/1232,Code public + weights closed,https://github.com/CharlesQ9/Self-Evolving-Agents,"no data — MDPI Electronics 2026; author names not confirmed from search; institution not recovered","MDPI Electronics 2026 15(6) 1232; published 16 March 2026; author affiliations not confirmed",text,no scale claim — research (MDPI Electronics 2025/2026),LLM-arbitrate (System 2 consensus write),below detection threshold
SYNAPSE,Cognitive-architecture-inspired,3 cites (3/yr),https://www.semanticscholar.org/paper/a0bd272b7d4ac151fbd0724f3cc77e2e2fa6941c,Too recent,https://arxiv.org/abs/2601.02744,Paper only,no public code,"Hanqi Jiang, Junhao Chen, Yi Pan, Ling Chen, Weihang You, Yifan Zhou, Ruidong Zhang, Andrea Sikora, Lin Zhao, Yohannes Abate, Tianming Liu; University of Georgia + University of Tennessee Knoxville + University of Colorado School of Medicine + New Jersey Institute of Technology","arxiv 2601.02744 Jan 2026; University of Georgia (School of Computing, Tianming Liu) is primary lab; multi-institution US",text,no scale claim — research,LLM-arbitrate (spreading-activation graph),below detection threshold
HeLa-Mem,Cognitive-architecture-inspired,not yet researched (too new — Apr 2026),https://arxiv.org/abs/2604.16839,Too recent,https://arxiv.org/abs/2604.16839,Paper only,no public code,"Jinchang Zhu, Jindong Li, Cheng Zhang, Jiahong Liu, Menglin Yang; Hong Kong University of Science and Technology (Guangzhou) + Jilin University + Chinese University of Hong Kong","arxiv 2604.16839 Apr 2026; HKUST(GZ) (Jinchang Zhu, Jindong Li, Menglin Yang) + Jilin U (Cheng Zhang) + CUHK (Jiahong Liu)",text,no scale claim — research,LLM-arbitrate (Hebbian distillation + consolidation),below detection threshold
NL2GenSym,Cognitive-architecture-inspired,not yet researched (Oct 2025 preprint),https://arxiv.org/abs/2510.09355,Too recent,https://arxiv.org/abs/2510.09355,Paper only,no public code,"Fang Yuan, Junjie Zeng, Yue Hu, Zhengqiu Zhu, Quanjun Yin, Yuxiang Xie; National University of Defense Technology (NUDT) Changsha","arxiv 2510.09355 Oct 2025; NUDT (Quanjun Yin — Full Professor School of Systems Engineering; Fang Yuan — Dept of Electronic Science and Technology; Zhengqiu Zhu — College of Systems Engineering)",text,>86% rule-generation success rate (not a deployment scale claim — research eval only),LLM-arbitrate (production-rule generation),below detection threshold
Episodic Memory Is the Missing Piece,Cognitive-architecture-inspired,35 cites (35/yr),https://www.semanticscholar.org/paper/f85004321e43370535088042ebac96b958880c5d,Too recent,https://arxiv.org/abs/2502.06975,Paper only (position paper),no public code,"Pink et al. — no affiliation confirmed from search; arxiv 2502.06975","arxiv 2502.06975 Feb 2025; affiliations not recovered; position paper",text,no scale claim — position paper,not applicable (position paper; no system implementation),below detection threshold
